chapter,question,option1,option2,option3,option4,correct
chapter1,What is the largest planet in our solar system?,Earth,Mars,Jupiter,Saturn,3
chapter1,Which planet is known as the Red Planet?,Venus,Mars,Jupiter,Mercury,2
chapter2,Who was the first person to walk on the Moon?,Buzz Aldrin,Yuri Gagarin,Neil Armstrong,Michael Collins,3
chapter2,What is the name of our galaxy?,Andromeda,Milky Way,Triangulum,Sombrero,2
chapter3,Which planet has the most extensive ring system?,Jupiter,Saturn,Uranus,Neptune,2
chapter3,What is the name of the first artificial satellite?,Apollo 11,Sputnik 1,Explorer 1,Voyager 1,2
chapter4,Which space telescope was launched in 1990 and still operates today?,James Webb,Spitzer,Hubble,Chandra,3
chapter4,Which planet is closest to the Sun?,Mercury,Venus,Earth,Mars,1